<?xml version="1.0" encoding="UTF-8"?>

<xs:schema xmlns:xs="http://www.w3.org/2001/XMLSchema">

		<xs:element name="prosumer">
		
			<xs:complexType>
				<xs:sequence>
					<xs:element name="mRID" minOccurs="1" maxOccurs="1"/>
					<xs:element name="name" minOccurs="1" maxOccurs="1"/>
					<xs:element name="latitude" minOccurs="1" maxOccurs="1">
						<xs:simpleType>
							<xs:restriction base="xs:decimal">
							  <xs:minInclusive value="-90"/>
							  <xs:maxInclusive value="90"/>
							</xs:restriction>
						</xs:simpleType>
					</xs:element>
					<xs:element name="longitude" minOccurs="1" maxOccurs="1">
						<xs:simpleType>
							<xs:restriction base="xs:decimal">
							  <xs:minInclusive value="-180"/>
							  <xs:maxInclusive value="180"/>
							</xs:restriction>
						</xs:simpleType>
					</xs:element>
					<xs:element name="pvPlantACRatedP" type="xs:decimal" minOccurs="1" maxOccurs="1"/>
					<xs:element name="pvPlantDCRatedP" type="xs:decimal" minOccurs="1" maxOccurs="1"/>
					<xs:element name="commissioningDate" type="xs:date" minOccurs="1" maxOccurs="1"/>
					<xs:element name="systemUpdate" type="xs:date" minOccurs="0" maxOccurs="1"/>
					<xs:element name="decommissioningDate" type="xs:date" minOccurs="0" maxOccurs="1"/>
					<xs:element name="description" minOccurs="0" maxOccurs="1"/>
					<xs:element name="location" minOccurs="0" maxOccurs="1"/>
				</xs:sequence>
			</xs:complexType>
		
		</xs:element>

</xs:schema>